{
  "schema_version": "client-refresh-parity-report.v1",
  "generated_at": "2026-10-01T19:59:01.437Z",
  "source_root": "/Users/fareed/Documents/dev/chatgpt/stdd",
  "client_root": "/Users/fareed/Documents/dev/chatgpt/stdd",
  "options": {
    "strict_refresh": false,
    "semantic_yaml_compare": false,
    "report_only": true
  },
  "parity_a": {
    "label": "templates_vs_methodology",
    "entries": [
      {
        "relative_path": ".tied-yaml.yaml",
        "disposition": "preserved_by_policy",
        "notes": "METHODOLOGY_TEMPLATE_ONLY allowlist"
      },
      {
        "relative_path": "agent-req-checklist-feat-spawned-phase5.v1.yaml",
        "disposition": "preserved_by_policy",
        "notes": "METHODOLOGY_TEMPLATE_ONLY allowlist"
      },
      {
        "relative_path": "architecture-decisions.yaml",
        "disposition": "drifted",
        "compare_mode": "sha256",
        "source_sha256": "216824a51b2dd1412f58acbf0ac912d3f0f15476b49684278267119712deec4f",
        "client_sha256": "c1e6f5d62e980ff04870f889d196ee14c1004ad9ea78d4a89922a1b8d988a8d4"
      },
      {
        "relative_path": "architecture-decisions/ARCH-BBCE_SLICE_OWNERSHIP_SNIPPET.yaml",
        "disposition": "missing",
        "notes": "missing client methodology file"
      },
      {
        "relative_path": "architecture-decisions/ARCH-EVIDENCE_CHAIN_PROFILE.yaml",
        "disposition": "missing",
        "notes": "missing client methodology file"
      },
      {
        "relative_path": "architecture-decisions/ARCH-FEEDBACK_STORAGE.yaml",
        "disposition": "missing",
        "notes": "missing client methodology file"
      },
      {
        "relative_path": "architecture-decisions/ARCH-MODULE_VALIDATION.yaml",
        "disposition": "missing",
        "notes": "missing client methodology file"
      },
      {
        "relative_path": "architecture-decisions/ARCH-QUALITY_ASSURANCE_PROFILES.yaml",
        "disposition": "missing",
        "notes": "missing client methodology file"
      },
      {
        "relative_path": "architecture-decisions/ARCH-TIED_ADVERSARIAL_INQUIRY.yaml",
        "disposition": "missing",
        "notes": "missing client methodology file"
      },
      {
        "relative_path": "architecture-decisions/ARCH-TIED_BOOTSTRAP_CROSS_PLATFORM.yaml",
        "disposition": "missing",
        "notes": "missing client methodology file"
      },
      {
        "relative_path": "architecture-decisions/ARCH-TIED_FIDELITY_RESEARCH.yaml",
        "disposition": "missing",
        "notes": "missing client methodology file"
      },
      {
        "relative_path": "architecture-decisions/ARCH-TIED_SPONSOR_AGENT_RELATIONSHIP.yaml",
        "disposition": "missing",
        "notes": "missing client methodology file"
      },
      {
        "relative_path": "architecture-decisions/ARCH-TIED_STRUCTURE.yaml",
        "disposition": "missing",
        "notes": "missing client methodology file"
      },
      {
        "relative_path": "impl-essence-pseudocode-template.md",
        "disposition": "preserved_by_policy",
        "notes": "METHODOLOGY_TEMPLATE_ONLY allowlist"
      },
      {
        "relative_path": "implementation-decisions.yaml",
        "disposition": "drifted",
        "compare_mode": "sha256",
        "source_sha256": "5e5718544b77c9fdce926cd06c6aea1dc1c37ce569ccc2494bd9d3929250da08",
        "client_sha256": "52dba010e4b0c0cf170747cb9e111adbe23e079fbd40187d5f33295e4ad33e1d"
      },
      {
        "relative_path": "implementation-decisions/IMPL-EVIDENCE_CHAIN_PROFILE-pseudocode.md",
        "disposition": "missing",
        "notes": "missing client methodology file"
      },
      {
        "relative_path": "implementation-decisions/IMPL-EVIDENCE_CHAIN_PROFILE.yaml",
        "disposition": "missing",
        "notes": "missing client methodology file"
      },
      {
        "relative_path": "implementation-decisions/IMPL-MCP_FEEDBACK_TOOLS-pseudocode.md",
        "disposition": "missing",
        "notes": "missing client methodology file"
      },
      {
        "relative_path": "implementation-decisions/IMPL-MCP_FEEDBACK_TOOLS.yaml",
        "disposition": "missing",
        "notes": "missing client methodology file"
      },
      {
        "relative_path": "implementation-decisions/IMPL-MODULE_VALIDATION-pseudocode.md",
        "disposition": "missing",
        "notes": "missing client methodology file"
      },
      {
        "relative_path": "implementation-decisions/IMPL-MODULE_VALIDATION.yaml",
        "disposition": "missing",
        "notes": "missing client methodology file"
      },
      {
        "relative_path": "implementation-decisions/IMPL-QUALITY_ASSURANCE_PILOT_WEBHOOK-pseudocode.md",
        "disposition": "missing",
        "notes": "missing client methodology file"
      },
      {
        "relative_path": "implementation-decisions/IMPL-QUALITY_ASSURANCE_PILOT_WEBHOOK.yaml",
        "disposition": "missing",
        "notes": "missing client methodology file"
      },
      {
        "relative_path": "implementation-decisions/IMPL-QUALITY_BINDING_INVENTORY-pseudocode.md",
        "disposition": "missing",
        "notes": "missing client methodology file"
      },
      {
        "relative_path": "implementation-decisions/IMPL-QUALITY_BINDING_INVENTORY.yaml",
        "disposition": "missing",
        "notes": "missing client methodology file"
      },
      {
        "relative_path": "implementation-decisions/IMPL-QUALITY_EVIDENCE_COLLECTION-pseudocode.md",
        "disposition": "missing",
        "notes": "missing client methodology file"
      },
      {
        "relative_path": "implementation-decisions/IMPL-QUALITY_EVIDENCE_COLLECTION.yaml",
        "disposition": "missing",
        "notes": "missing client methodology file"
      },
      {
        "relative_path": "implementation-decisions/IMPL-QUALITY_EVIDENCE_COMMAND_RUNNER-pseudocode.md",
        "disposition": "missing",
        "notes": "missing client methodology file"
      },
      {
        "relative_path": "implementation-decisions/IMPL-QUALITY_EVIDENCE_COMMAND_RUNNER.yaml",
        "disposition": "missing",
        "notes": "missing client methodology file"
      },
      {
        "relative_path": "implementation-decisions/IMPL-QUALITY_EVIDENCE_MANIFEST-pseudocode.md",
        "disposition": "missing",
        "notes": "missing client methodology file"
      },
      {
        "relative_path": "implementation-decisions/IMPL-QUALITY_EVIDENCE_MANIFEST.yaml",
        "disposition": "missing",
        "notes": "missing client methodology file"
      },
      {
        "relative_path": "implementation-decisions/IMPL-QUALITY_PSEUDOCODE_VALIDATOR-pseudocode.md",
        "disposition": "missing",
        "notes": "missing client methodology file"
      },
      {
        "relative_path": "implementation-decisions/IMPL-QUALITY_PSEUDOCODE_VALIDATOR.yaml",
        "disposition": "missing",
        "notes": "missing client methodology file"
      },
      {
        "relative_path": "implementation-decisions/IMPL-QUALITY_SECURITY_PROFILE_VALIDATION-pseudocode.md",
        "disposition": "missing",
        "notes": "missing client methodology file"
      },
      {
        "relative_path": "implementation-decisions/IMPL-QUALITY_SECURITY_PROFILE_VALIDATION.yaml",
        "disposition": "missing",
        "notes": "missing client methodology file"
      },
      {
        "relative_path": "implementation-decisions/IMPL-QUALITY_TEST_ADEQUACY-pseudocode.md",
        "disposition": "missing",
        "notes": "missing client methodology file"
      },
      {
        "relative_path": "implementation-decisions/IMPL-QUALITY_TEST_ADEQUACY.yaml",
        "disposition": "missing",
        "notes": "missing client methodology file"
      },
      {
        "relative_path": "implementation-decisions/IMPL-TIED_ADVERSARIAL_INQUIRY-pseudocode.md",
        "disposition": "missing",
        "notes": "missing client methodology file"
      },
      {
        "relative_path": "implementation-decisions/IMPL-TIED_ADVERSARIAL_INQUIRY.yaml",
        "disposition": "missing",
        "notes": "missing client methodology file"
      },
      {
        "relative_path": "implementation-decisions/IMPL-TIED_ADVERSARIAL_INQUIRY_CHECKLIST-pseudocode.md",
        "disposition": "missing",
        "notes": "missing client methodology file"
      },
      {
        "relative_path": "implementation-decisions/IMPL-TIED_ADVERSARIAL_INQUIRY_CHECKLIST.yaml",
        "disposition": "missing",
        "notes": "missing client methodology file"
      },
      {
        "relative_path": "implementation-decisions/IMPL-TIED_FIDELITY_RESEARCH-pseudocode.md",
        "disposition": "missing",
        "notes": "missing client methodology file"
      },
      {
        "relative_path": "implementation-decisions/IMPL-TIED_FIDELITY_RESEARCH.yaml",
        "disposition": "missing",
        "notes": "missing client methodology file"
      },
      {
        "relative_path": "implementation-decisions/IMPL-TIED_FILES-pseudocode.md",
        "disposition": "missing",
        "notes": "missing client methodology file"
      },
      {
        "relative_path": "implementation-decisions/IMPL-TIED_FILES.yaml",
        "disposition": "missing",
        "notes": "missing client methodology file"
      },
      {
        "relative_path": "implementation-decisions/IMPL-TIED_SPONSOR_AGENT_RELATIONSHIP-pseudocode.md",
        "disposition": "missing",
        "notes": "missing client methodology file"
      },
      {
        "relative_path": "implementation-decisions/IMPL-TIED_SPONSOR_AGENT_RELATIONSHIP.yaml",
        "disposition": "missing",
        "notes": "missing client methodology file"
      },
      {
        "relative_path": "processes.md",
        "disposition": "preserved_by_policy",
        "notes": "METHODOLOGY_TEMPLATE_ONLY allowlist"
      },
      {
        "relative_path": "requirements.yaml",
        "disposition": "drifted",